{
    "kcal_burned": {
        "value": 1635,
        "unit": "kcal"
    },
    "effective_time_frame": {
        "time_interval": {
            "start_date_time": "2026-02-05T07:00:00Z",
            "end_date_time": "2023-06-06T07:00:00Z"
        }
    },
    "descriptive_statistic": "average",
    "descriptive_statistic_denominator": "d"
}